[
  {
    "id": "harness-os-light",
    "label": "HARNESS OS · 暖纸",
    "description": "暖纸白底、橙色强调、近黑等宽标注 —— 取自 HARNESS OS 控制台视觉。浅色。",
    "colorScheme": "light",
    "tokens": {
      "--dsw-alias-bg-base": { "light": "#efedea", "dark": "#efedea" },
      "--dsw-alias-bg-layer-1": { "light": "#f4f3f1", "dark": "#f4f3f1" },
      "--dsw-alias-bg-layer-2": { "light": "#f8f7f5", "dark": "#f8f7f5" },
      "--dsw-alias-bg-layer-3": { "light": "#fbfaf9", "dark": "#fbfaf9" },
      "--dsw-alias-bg-overlay": { "light": "#f8f7f5", "dark": "#f8f7f5" },
      "--dsw-alias-bg-skeleton": { "light": "#1515140f", "dark": "#1515140f" },
      "--dsw-alias-bg-module-platform": { "light": "#eae7e3", "dark": "#eae7e3" },
      "--dsw-alias-bg-multi-select": { "light": "#eae7e3", "dark": "#eae7e3" },

      "--dsw-alias-border-l1": { "light": "#15151412", "dark": "#15151412" },
      "--dsw-alias-border-l2": { "light": "#1515141f", "dark": "#1515141f" },
      "--dsw-alias-border-l3": { "light": "#1515142b", "dark": "#1515142b" },
      "--dsw-alias-border-l4": { "light": "#15151438", "dark": "#15151438" },

      "--dsw-alias-brand-primary": { "light": "#ff7500", "dark": "#ff7500" },
      "--dsw-alias-brand-primary-invert": { "light": "#ffffff", "dark": "#ffffff" },
      "--dsw-alias-brand-text": { "light": "#c95600", "dark": "#c95600" },

      "--dsw-alias-label-primary": { "light": "#151514", "dark": "#151514" },
      "--dsw-alias-label-primary-bluish": { "light": "#151514", "dark": "#151514" },
      "--dsw-alias-label-secondary": { "light": "#5c5852", "dark": "#5c5852" },
      "--dsw-alias-label-tertiary": { "light": "#837e77", "dark": "#837e77" },
      "--dsw-alias-label-caption": { "light": "#9a948c", "dark": "#9a948c" },
      "--dsw-alias-label-dimmed": { "light": "#b3aca3", "dark": "#b3aca3" },
      "--dsw-alias-label-primary-dimmed": { "light": "#5c5852", "dark": "#5c5852" },
      "--dsw-alias-label-primary-foreground": { "light": "#ffffff", "dark": "#ffffff" },
      "--dsw-alias-label-primary-inverted": { "light": "#ffffff", "dark": "#ffffff" },
      "--dsw-alias-label-error": { "light": "#d93a2b", "dark": "#d93a2b" },
      "--dsw-alias-link": { "light": "#c95600", "dark": "#c95600" },

      "--dsw-alias-state-error-primary": { "light": "#d93a2b", "dark": "#d93a2b" },
      "--dsw-alias-state-error-secondary": { "light": "#e8735f", "dark": "#e8735f" },
      "--dsw-alias-state-idle-primary": { "light": "#b8b1a8", "dark": "#b8b1a8" },
      "--dsw-alias-state-success-primary": { "light": "#2f8f5b", "dark": "#2f8f5b" },
      "--dsw-alias-state-success-secondary": { "light": "#5aab7c", "dark": "#5aab7c" },
      "--dsw-alias-state-success-tertiary": { "light": "#dff0e6", "dark": "#dff0e6" },
      "--dsw-alias-state-warn-primary": { "light": "#d98a00", "dark": "#d98a00" },
      "--dsw-alias-state-warn-secondary": { "light": "#e8a63d", "dark": "#e8a63d" },
      "--dsw-alias-state-warn-tertiary": { "light": "#fbf0dc", "dark": "#fbf0dc" },
      "--dsw-alias-state-warn-label": { "light": "#a86a00", "dark": "#a86a00" },
      "--dsw-alias-state-business-primary": { "light": "#ff7500", "dark": "#ff7500" },
      "--dsw-alias-state-business-tertiary": { "light": "#ffe8d1", "dark": "#ffe8d1" },

      "--dsw-alias-interactive-bg-hover": { "light": "#ff750014", "dark": "#ff750014" },
      "--dsw-alias-interactive-bg-active": { "light": "#ff750024", "dark": "#ff750024" },
      "--dsw-alias-interactive-bg-hover-accent": { "light": "#ff750024", "dark": "#ff750024" },
      "--dsw-alias-interactive-bg-hover-solid": { "light": "#eae7e3", "dark": "#eae7e3" },
      "--dsw-alias-interactive-bg-hover-danger": { "light": "#d93a2b0d", "dark": "#d93a2b0d" },

      "--dsw-alias-markdown-code-block": { "light": "#e9e6e2", "dark": "#e9e6e2" },
      "--dsw-alias-markdown-code-block-banner": { "light": "#e4e1dc", "dark": "#e4e1dc" },
      "--dsw-alias-markdown-inline-code": { "light": "#e9e6e2", "dark": "#e9e6e2" },
      "--dsw-alias-markdown-tag": { "light": "#eae7e3", "dark": "#eae7e3" },
      "--dsw-alias-markdown-citation": { "light": "#eae7e3", "dark": "#eae7e3" },
      "--dsw-alias-markdown-placeholder": { "light": "#b3aca3", "dark": "#b3aca3" },
      "--dsw-alias-markdown-code-segment-selected": { "light": "#fbfaf9", "dark": "#fbfaf9" },
      "--dsw-alias-markdown-code-segment-unselected": { "light": "#e9e6e2", "dark": "#e9e6e2" },

      "--dsw-alias-turn-trigger-bg": { "light": "#e9e6e2", "dark": "#e9e6e2" },
      "--dsw-alias-turn-trigger-bg-hover": { "light": "#ff750014", "dark": "#ff750014" },

      "--dsw-alias-scrollbar-bg-l1": { "light": "#1515141a", "dark": "#1515141a" },
      "--dsw-alias-scrollbar-bg-l2": { "light": "#1515141a", "dark": "#1515141a" },
      "--dsw-alias-scrollbar-hover-l1": { "light": "#15151433", "dark": "#15151433" },
      "--dsw-alias-scrollbar-hover-l2": { "light": "#15151433", "dark": "#15151433" },

      "--dsw-alias-tooltip-bg": { "light": "#2b2926", "dark": "#2b2926" },
      "--dsw-alias-tooltip-key-bg": { "light": "#413e3a", "dark": "#413e3a" },
      "--dsw-alias-toast-bg": { "light": "#2b2926", "dark": "#2b2926" },
      "--dsw-alias-toast-label": { "light": "#f4f3f1", "dark": "#f4f3f1" },

      "--dsw-alias-settings-card-fill": { "light": "#f4f3f1", "dark": "#f4f3f1" },
      "--dsw-alias-settings-card-stroke": { "light": "#15151438", "dark": "#15151438" },

      "--dsw-alias-menu-group-header-fill": { "light": "#f4f3f1f0", "dark": "#f4f3f1f0" },
      "--dsw-alias-menu-icon": { "light": "#5c5852", "dark": "#5c5852" },
      "--dsw-alias-switch-thumb": { "light": "#ffffff", "dark": "#ffffff" },
      "--dsw-alias-button-primary-fill": { "light": "#ff7500", "dark": "#ff7500" },
      "--dsw-alias-button-primary-hover": { "light": "#e86a00", "dark": "#e86a00" },
      "--dsw-alias-button-primary-dimmed": { "light": "#ff750029", "dark": "#ff750029" },
      "--dsw-alias-button-elevated-fill": { "light": "#fbfaf9", "dark": "#fbfaf9" },
      "--dsw-alias-button-floating-fill": { "light": "#fbfaf9", "dark": "#fbfaf9" },
      "--dsw-alias-button-floating-hover": { "light": "#f4f3f1", "dark": "#f4f3f1" },
      "--dsw-alias-button-contrast-fill": { "light": "#151514", "dark": "#151514" },
      "--dsw-alias-button-ghost-active-fill": { "light": "#eae7e3", "dark": "#eae7e3" },
      "--dsw-alias-button-ghost-active-hover": { "light": "#e4e1dc", "dark": "#e4e1dc" },
      "--dsw-alias-button-ghost-active-border": { "light": "#15151438", "dark": "#15151438" },

      "--dsw-alias-code-diff-added": { "light": "#2f8f5b1f", "dark": "#2f8f5b1f" },
      "--dsw-alias-code-diff-deleted": { "light": "#d93a2b1f", "dark": "#d93a2b1f" },
      "--dsw-alias-file-diff-added-bg": { "light": "#e6f1e9", "dark": "#e6f1e9" },
      "--dsw-alias-file-diff-added-gutter": { "light": "#edf5f0", "dark": "#edf5f0" },
      "--dsw-alias-file-diff-added-marker": { "light": "#2f8f5b", "dark": "#2f8f5b" },
      "--dsw-alias-file-diff-deleted-bg": { "light": "#f7e6e3", "dark": "#f7e6e3" },
      "--dsw-alias-file-diff-deleted-gutter": { "light": "#faedeb", "dark": "#faedeb" },
      "--dsw-alias-file-diff-deleted-marker": { "light": "#c33a2c", "dark": "#c33a2c" },

      "--dsw-alias-bg-mask-1": { "light": "#0000003d", "dark": "#0000003d" },
      "--dsw-alias-bg-mask-2": { "light": "#0000001f", "dark": "#0000001f" },
      "--dsw-alias-bg-mask-3": { "light": "#0000007a", "dark": "#0000007a" },
      "--dsw-alias-bg-mask-drop": { "light": "#fbfaf9b3", "dark": "#fbfaf9b3" },
      "--dsw-alias-bg-mask-photo": { "light": "#000000e0", "dark": "#000000e0" },

      "--dsw-alias-bg-document-preview": { "light": "#fbfaf9", "dark": "#fbfaf9" },
      "--dsw-alias-label-document-preview": { "light": "#5c5852", "dark": "#5c5852" },
      "--dsw-alias-bg-document-selection": { "light": "#ff750033", "dark": "#ff750033" },

      "--dsw-alias-onboarding-accent": { "light": "#ff7500", "dark": "#ff7500" },
      "--dsw-alias-onboarding-card-fill": { "light": "#f8f7f5", "dark": "#f8f7f5" },
      "--dsw-alias-onboarding-secondary-fill": { "light": "#fbfaf9", "dark": "#fbfaf9" },
      "--dsw-alias-onboarding-checkbox-border": { "light": "#15151433", "dark": "#15151433" },

      "--dsw-alias-button-tool-bar-fill": { "light": "#54555780", "dark": "#54555780" },
      "--dsw-alias-button-tool-bar-hover": { "light": "#54555799", "dark": "#54555799" },
      "--dsw-alias-button-tool-bar-fill-invisible": { "light": "#1f1f1f5c", "dark": "#1f1f1f5c" },

      "--dsw-specific-sidebar-fill": { "light": "#eae7e3", "dark": "#eae7e3" },

      "--dsw-elevation-stroke-color": { "light": "#1515141f", "dark": "#1515141f" },
      "--dsw-focus-ring-color": { "light": "#ff750080", "dark": "#ff750080" },
      "--dsw-desktop-window-tint": { "light": "#ffffff66", "dark": "#ffffff66" }
    }
  },
  {
    "id": "harness-os-dark",
    "label": "HARNESS OS · 墨夜",
    "description": "暖黑底、橙色强调 —— 与浅色同源的深色变体，供夜间使用。",
    "colorScheme": "dark",
    "tokens": {
      "--dsw-alias-bg-base": { "light": "#141311", "dark": "#141311" },
      "--dsw-alias-bg-layer-1": { "light": "#1c1a17", "dark": "#1c1a17" },
      "--dsw-alias-bg-layer-2": { "light": "#242220", "dark": "#242220" },
      "--dsw-alias-bg-layer-3": { "light": "#2c2926", "dark": "#2c2926" },
      "--dsw-alias-bg-overlay": { "light": "#242220", "dark": "#242220" },
      "--dsw-alias-bg-skeleton": { "light": "#ffffff0f", "dark": "#ffffff0f" },
      "--dsw-alias-bg-module-platform": { "light": "#1c1a17", "dark": "#1c1a17" },
      "--dsw-alias-bg-multi-select": { "light": "#242220", "dark": "#242220" },

      "--dsw-alias-border-l1": { "light": "#ffffff12", "dark": "#ffffff12" },
      "--dsw-alias-border-l2": { "light": "#ffffff1f", "dark": "#ffffff1f" },
      "--dsw-alias-border-l3": { "light": "#ffffff2b", "dark": "#ffffff2b" },
      "--dsw-alias-border-l4": { "light": "#ffffff38", "dark": "#ffffff38" },